[
  {
    "id": "token-baron-pit",
    "name": "Baron Pit",
    "type": "Battlefield",
    "supertype": "Token",
    "text": { "rich": "<p>Units can move here from anywhere.</p>", "plain": "Units can move here from anywhere." }
  },
  {
    "id": "token-bird",
    "name": "Bird",
    "type": "Unit",
    "supertype": "Token",
    "might": 1,
    "tags": ["Bird"],
    "keywords": ["Deflect"],
    "text": { "rich": "<p>[Deflect]</p>", "plain": "[Deflect]" }
  },
  {
    "id": "token-brush",
    "name": "Brush",
    "type": "Battlefield",
    "supertype": "Token",
    "text": {
      "rich": "<p>Bird, Cat, Dog, Poro, and Ivern units here have +1 :rb_might:.<br />When you score here, you may replace this with the battlefield it replaced.</p>",
      "plain": "Bird, Cat, Dog, Poro, and Ivern units here have +1 :rb_might:. When you score here, you may replace this with the battlefield it replaced."
    }
  },
  {
    "id": "token-gold",
    "name": "Gold",
    "type": "Gear",
    "supertype": "Token",
    "keywords": ["Reaction"],
    "text": {
      "rich": "<p>[Reaction][&gt;] Kill this, :rb_exhaust:: [Add] :rb_rune_rainbow:.</p>",
      "plain": "[Reaction] Kill this, :rb_exhaust:: [Add] :rb_rune_rainbow:."
    }
  },
  { "id": "token-mech", "name": "Mech", "type": "Unit", "supertype": "Token", "might": 3, "tags": ["Mech"], "text": {} },
  { "id": "token-recruit", "name": "Recruit", "type": "Unit", "supertype": "Token", "might": 1, "tags": ["Recruit"], "text": {} },
  { "id": "token-reflection", "name": "Reflection", "type": "Unit", "supertype": "Token", "might": 0, "text": {} },
  { "id": "token-sand-soldier", "name": "Sand Soldier", "type": "Unit", "supertype": "Token", "might": 2, "tags": ["Shurima"], "text": {} },
  {
    "id": "token-shadow-clone",
    "name": "Shadow Clone",
    "type": "Unit",
    "supertype": "Token",
    "might": 0,
    "keywords": ["Assault"],
    "text": {
      "rich": "<p>When I attack, you may banish a unit from your trash. If you do, give me [Assault 4] this turn.</p>",
      "plain": "When I attack, you may banish a unit from your trash. If you do, give me [Assault 4] this turn."
    }
  },
  {
    "id": "token-sprite",
    "name": "Sprite",
    "type": "Unit",
    "supertype": "Token",
    "might": 3,
    "tags": ["Fae"],
    "keywords": ["Temporary"],
    "text": { "rich": "<p>[Temporary]</p>", "plain": "[Temporary]" }
  },
  { "id": "token-tentacle", "name": "Tentacle", "type": "Unit", "supertype": "Token", "might": 1, "tags": ["Bilgewater"], "text": {} }
]
